date,review,rating,isEdited,userName,title,developerResponse,Country
2021-12-15 00:13:56,"Use data from the health app like sleep data, exercise/calories burned/movement, O2 levels, etc. The fact that you don’t use this data makes your app way less useful",2,False,Maxster/5555,Add sleep data,"{'id': 26900043, 'body': 'Hi! The app uses sleep, exercise, calories, and heart data from Apple Health. Please, Make sure you’ve provided access to the app to read this data, so you can see the analytics & personal insights in the app.\n\nOpen the Health app on your iPhone -> Go to the Summary Tab -> Tap your profile picture in the top right-hand corner -> Under Privacy, tap Apps -> find Stress Monitor -> provide access to all categories in the list.\n\nPlease, contact us at dev@activeace.app if it wouldn’t help and we’ll do our best to solve the issue. \n\nBest Wishes, Elena', 'modified': '2021-12-17T15:36:16Z'}",US
2023-05-09 04:46:11,It’s great still trying to learn all about this appt.. thanks,5,False,Ms. Robbin,Sleep,,US
2021-09-03 10:06:18,"I’m using this app for about half a year now. Since that time I've become more attentive to my health and body signals. At first, I noticed patterns between my stress and data in the app. Now, if I see my stress data in the red zone over the week, it's a reliable sign that I need a recharge. For example, a couple of weeks ago I was sick for a few days. But even when I already felt relatively well, the app showed very low scores. I went to workout and felt how little strength I had and that I could physically do much less than before my illness. The app said that I need more time for recovery and it was absolutely true. And I always see those patterns. Or when I’m tired after a hard week, or if I forget to have lunch during the day, my score in the app goes down. When I follow the recommendations in the app and get enough sleep, regularly achieve my activity goals, dedicate enough time for rest - I see how my physical and mental health get better and my scores in the app go up. I’m less nervous and depressed and become more productive and balanced instead. 
The app provides very useful insights about my stressors and helps to catch and manage them. On average, I have about 5-7 automatic readings during the day. This is enough for me to have an idea of where I’m going. It is also easy to use the app on the watch to check my stress level during the day. 

To sum up, this app is essential for those who thrive on self-care and self-improvements. It provides you with great insights into your health and stressors, helps to manage them and achieve a healthy balance in your life.",5,False,elena_amb,"Excellent, works with Apple Health","{'id': 24943095, 'body': 'Hi! Thank you a lot for such great feedback! It means a lot to us! We are happy to be with you all this time and help you to monitor your daily stressors and bring a more healthy balance in your life. Please, feel free to contact us if you have any questions or we can make the app better for you.\n\nWarm Wishes, Stress Monitor Team. ', 'modified': '2021-09-06T16:48:46Z'}",US
2022-11-25 17:04:56,"Doesn’t match results of multiple other apps, huge disparity between this and other higher quality apps. Maybe hire a native language speaker to proofread grammar and contextual messages.",1,False,fltrip59,"Waste of time, random feedback","{'id': 33458510, 'body': 'Hi! We are sorry you are disappointed with the app. We will take your feedback into account to make the app better.\n\nBest Wishes,\nStress Monitor Team', 'modified': '2022-11-30T17:31:27Z'}",US
2022-11-08 12:43:25,This app seems to still be in its infancy. I wish I could get my money back it was not what it said it could be. It tells you you are stressed at times when you are not it crashed all the time.,1,False,Dumblefumble,Does not work,,US
2022-11-05 19:56:13,"This app consistently rates my stress as very high and does not sync with my actual levels of activity. According to this app, I’m likely going to collapse soon while all my indicators are in a very healthy range according to my measures taken by other reliable means.",1,False,SheilaBSmith,Inaccurate,,US
2022-01-28 11:18:21,It’s been a week since the app is crashing when opening and the developers just wait and smoke,1,False,KatieHou,It’s been a week since the app is crashing when opening and the developers just wait and smoke,"{'id': 27814183, 'body': 'HI, thank you for using our app and for your feedback. \nOur team is working to fix the issue. It would be helpful if you can share with us any details about the crashes at dev@activeace.app.\nBest Wishes, Elena', 'modified': '2022-02-02T21:32:59Z'}",US
2022-11-05 17:02:42,Definitely keeps me mindful of my stress levels and what may be causing my stress.,4,False,Pepperann3,Enjoying the App,,US
2022-11-21 23:47:10,"I have a lot of illness therefore a lot of stress so messages come up and I don’t understand how to interpret them. They come up when I am resting, sleeping, etc and they mean nothing to me. I would like a refund please.",1,False,seaape,Have a lot of illness so don’t understand stress messages,"{'id': 33338325, 'body': 'Hi! We’re sorry our app didn’t meet your expectations. We continuously working to make it better and to bring more value to all our users. Please, contact us at dev@activeace.app and we’ll share the instructions how to cancel your subscription and for refund.\n\nBest Wishes,\nElena Strok\nFounder of Stress Monitor App', 'modified': '2022-11-24T02:53:39Z'}",US
2023-02-13 15:18:07,"More information about how to affect a score or activate the daily heat monitor. 
There are many things here that make no sense and have no explanation that I can find.",2,False,callaesutton,I don’t know how it works,,US
2022-12-17 18:11:23,I paid for this app.  It is a waste of money.  I can be TOTALLY stressed to the max and it will alert and say ‘great’.   I can be having the best time and it will alert saying ‘pay attention’.  Very disappointed.  Does NOT work at all.   Save your money.,1,False,Tall Frye,Save your money,"{'id': 34070094, 'body': 'Hi! We’re sorry our app didn’t meet your expectations. Please, contact us at dev@activeace.app if you need assistance in canceling your subscription or requesting a refund.\n\nBest Wishes,\nStress Monitor Team', 'modified': '2023-01-03T16:41:54Z'}",US
2022-09-01 11:17:40,Shows you a tiny bit of data before asking you to pay. Had a bug that made the app believe it was the wrong day. Not clearly laid out.,2,False,Brandon7770,Huh?,"{'id': 32019998, 'body': 'Hi! We’re sorry our app didn’t meet your expectations. You can use Stress Monitor App on the Apple Watch for free and see if it works for you. It also includes free Stress Monitor Watch Face and notifications on your stress level. Please, feel free to contact us at dev@activeace.app if you have any other questions and I’ll be happy to help. Best Wishes, Elena Strok, Founder of Stress Monitor App', 'modified': '2022-09-14T15:43:58Z'}",US
2023-04-16 16:04:08,Essentially when I’m seated or still and not moving the app reads my stress level as low. Once I begin to move around the app reads my stress level as high. The app is a little misleading in what it promises and how it realistically performs.,1,False,Soy Bean ATL,Disappointed,,US
2023-04-28 12:53:03,I’m being pestered by this app,5,False,MCSNam,Please close out this acct.  I’m being pestered,,US
2022-08-22 03:45:05,Great feedback.  Missing auto sleep log.,3,False,SeaSaltNeb,Missing auto-sleep information,"{'id': 31621685, 'body': 'Hi! Thank you for your feedback. The app reads the sleep data from your Apple Health. If you have sleep data in your Apple Health, our app will process this data and show the important sleep insights for managing stress.\n\nWe’ll take your feedback into account to make the app better. \n\nIf you have any other questions or suggestions, please, feel free to contact us at dev@activeace.app and I’ll be happy to help. \n\nBest Wishes,\nElena Strok\nFounder of Stress Monitor App', 'modified': '2022-08-23T14:35:24Z'}",US
2022-06-26 03:06:20,"This app collects your data, gives you feedback for the last week (where you clearly need this insights) and then demands you pay to go further. Not the slightest bit free. Just admit upfront you’re paid only.",1,False,Liesl19,Baloney. Don’t bother.,"{'id': 30580719, 'body': 'Hi! We’re sorry, you are disappointed with the app. The app requests access to read your data to calculate your personal algorithm for monitoring stress. After this, you can use Stress Monitor App on the Apple Watch for free. It also includes Stress Monitor Watch Face and the notifications on your stress level. Best Wishes, Elena Strok Founder of Stress Monitor App', 'modified': '2022-06-27T14:06:47Z'}",US
2023-05-22 22:38:19,This used to be a great app. It used to be free and now it’s forcing you to pay for it. So I have deleted it from my phone.,3,False,raymond258,Fee,,US
2023-05-21 11:31:33,"I love how you spend all that time setting up the app and the right before you actually use it, it requires money. Would be nice if that was disclosed at the beginning. 

This is bait-and-switch, which is a form of fraud.",1,False,patzivota,Deceptive,,US
2023-05-18 03:19:33,"Without warning, free content is no longer accessible and a year of data disappeared along with it. It’s fine to change your billing, but reflects poorly on your company ethics that you gave no warning.",1,False,😊😻🐶,Boo hiss,,US
2023-01-06 03:55:00,All is well. Stop asking me to write a review.,5,False,iamdonejustsend,Please Stop Asking,"{'id': 34180659, 'body': 'Hi! Thank you for taking the time to leave a review for our app. We are happy to know you enjoy the app. We’ll continue to work hard to improve the app and provide a great experience for all of our users.\n\nBest Wishes,\nElena Strok\nFounder of Stress Monitor App', 'modified': '2023-01-09T15:34:12Z'}",US
2022-11-27 11:14:52,"I love knowing that my vitals are good and my
Body is running smooth",5,False,almost Paradise4,I love this app,"{'id': 33458336, 'body': 'Hi! Thank you for your review! We are happy to know that the app is helpful for you! \n\nBest Wishes,\nElena Strok\nFounder of Stress Monitor App', 'modified': '2022-11-30T17:20:55Z'}",US
2021-04-23 21:29:04,Never understood the culture of subscriptions. You should be able to just buy the application or use a truncated free version. Too expensive for a mere application. The price is almost offensive.,2,False,Andres_Isique,Pricey,"{'id': 22598619, 'body': 'Hi! You can use Stress Monitor App on your Watch for free.\nWhen you try the app on Watch and like it, you can decide about the premium subscription.\nIn premium, you’ll find new unique features, that are available only in our app. Such as, running all-day stress tracking, personal stress highlights, and others that are tailored using an advanced personal algorithm for each our user.\n\nWe’ll be glad if you take advantage of our app.\n\nBest Wishes, Stress Monitor team.', 'modified': '2021-05-03T19:05:12Z'}",US
2023-05-19 13:36:03,Your app has been very helpful for me in that I’m able to see how my boby is managing stress post surgery. I’m now starting to see a trend upward and it is making me feel less stressed knowing that my body is progressing positively and that I’m healing.,1,False,Orchidgirl33,Stress Post Surgery,,US
2022-11-29 16:23:14,"I just don’t get the benefit of this app.  I have read the articles and FAQs, but a lot of what they report is common sense.  Next time I will not be so quick to subscribe to something without testing it first.",1,False,Ma651,Not worth the money,"{'id': 33477465, 'body': 'Hi! We’re sorry our app didn’t meet your expectations. If you have any questions or need assistance in canceling your subscription, please, feel free to contact us at dev@activeace.app and we’ll be happy to help.\n\nBest Wishes, \nStress Monitor Team', 'modified': '2022-12-01T14:44:13Z'}",US
2023-03-12 19:14:34,Is a wake up to do calming exercise and focus on myself -lighten stress,5,False,no more tries for nicknames,Stress level,,US
2023-05-26 16:29:21,"Without having that paid subscription, you have 0 features to use, stupid and greedy. Incorrect 90% of the time",1,False,4StrokeClimax,This app redirects you to their paid subscription,,US
2022-05-03 14:37:15,Guys for someone who is color blind distinguishing between “pay attention” and “ great” is impossible,4,False,prezesnyc,Ok app,"{'id': 29681733, 'body': 'Hi! Thank you for your feedback! We’ll do our best to fix colors in the upcoming app update and will be happy to know if it becomes better for you. Feel free to contact us at dev@activeace.app with any feedback, questions, or suggestions. \nBest Wishes, Elena Strok, Founder of Stress Monitor App', 'modified': '2022-05-11T08:45:33Z'}",US
2023-01-10 13:42:10,"Repeatedly said I was overloaded with stress while I was reading, meditating, feeling calm and happy but said I was doing great when I was having a panic attack. It’s inaccurate at best and probably a scam. I’ve uninstalled and cancelled my subscription.",1,False,Spree0129,Not accurate at all,"{'id': 34339644, 'body': ""Hi! We are sorry our app didn’t meet your expectations. The stress in the app is not only emotional or psychological but physical as well. Bad sleep last night, alcohol, exhausting workout - all these can lower your body's resistance to stress the next day or longer. Please, contact us at dev@activeace.app if you have any other questions and we’ll be happy to help. \n\nBest Wishes, \nStress Monitor Team"", 'modified': '2023-01-17T16:24:03Z'}",US
2022-10-30 14:09:42,Couldn’t see much relevant information. Was always prompted to buy premium. Just don’t need one more subscription.,2,False,Loysann,Requires premium for relevant data,,US
2022-10-09 20:34:15,"Couldn’t do anything without purchasing the subscription…should have been my first warning. I have a naturally high heart rate so according to this, I’m always way stressed. Wish I could get my money back 🥲",1,False,Zoo-tired,Horrible.,"{'id': 32648123, 'body': 'Hi! We’re sorry you’re disappointed with the app. If you have any questions or need assistance in canceling your subscription or getting a refund, please, feel free to contact us at dev@activeace.app. Best Wishes, Elena Strok', 'modified': '2022-10-18T15:04:16Z'}",US
2022-01-31 03:13:32,I am disappointed that this app requires a subscription before I can even learn about how to use the app… Why would I bother paying for it if I can’t even get a feel of its usefulness first?,1,False,sarbray,Requires a subscription,"{'id': 27814127, 'body': 'Hi! Our App calculates a personal algorithm for monitoring stress. After this, you can use Stress Monitor App on your Apple Watch for free and see how it works for you. In the free Apple Watch app, you can see your last stress zone, hrv, and stress insights. If you have any questions about the app - please, always feel free to contact us at dev@activeace.app. Best Wishes, Elena from Stress Monitor Team', 'modified': '2022-02-02T21:24:49Z'}",US
2021-11-09 16:07:22,"I downloaded the app and it asked for my my data. I gave it my data, then it asked me to subscribe and no way past the screen. Basically it took my data and then told me to subscribe. Unethical at best.",1,False,Educationvictm88,Something is wrong,"{'id': 26219249, 'body': ""Hi, let me clarify this. The App doesn’t provide an option to create an account therefore, we don't store and don't have access to your entries and data. Your health data are stored locally on your device. All calculations are done on your device as well.  \nThe app requests access only to read your data. It's necessary to calculate your personal algorithm to measure stress with your Apple Watch. When the personal model is calculated - you can use the app on your watch for free. In the Apple Watch App, you can check your last stress level and see your recent stress insights. If you decide about the premium app version - you can choose to make a subscription. \n\nPlease, feel free to contact us if something remained unclear - I’ll be happy to provide more details.\n\nBest Wishes, Elena from Stress Monitor Team"", 'modified': '2021-11-11T18:23:09Z'}",US
2021-08-03 04:20:10,"It collects ALL of your health data and then immediately slaps a paywall in front of you before you get to any real features. Then, you can’t get passed the paywall to delete your account and erase your data. There’s no way this is GDPR compliant.",1,False,whit-kn33,Don’t download,"{'id': 24335483, 'body': ""Hello, let me clarify this moment. The App doesn’t provide an option to create an account therefore, we don't store and don't have access to your entries and data. Your health data are stored locally on your device. All calculations are done on your device as well. You can optionally backup your data to Apple iCloud. Your backups are stored in your private cloud space and we don’t have access to your backup files. You can delete the data related to the app or stop recording it at any time at your iCloud. Please, contact us at dev@activeace.app and we’ll provide instructions how to do it. \n\nAlso, if you are not sure about the premium version with deep dive analytics you can continue to use our app on Apple Watch for free. \nPlease, feel free to contact us and we’ll be glad to help with any question about Stress Monitor App.\n\nBest Wishes, Elena "", 'modified': '2021-08-05T12:52:54Z'}",US
2023-02-27 14:15:02,Very useful app to help me understand my stress patterns and respond to it.,5,False,seattle2021,Help me understand my stress pattern,,US
2023-05-25 23:00:26,It was great monitoring my day to day levels but now (after the latest update). You now have to subscribe to see anything. I was thinking about it to get more data but I will NOT be forced.,1,False,NcC0WBoy,Greed,,US
2022-10-09 01:52:10,Has,5,False,Redslp,"Simple, but helpful application!","{'id': 32648100, 'body': 'Thank you for your feedback! We’re happy to know you are enjoying the app!', 'modified': '2022-10-18T15:02:55Z'}",US
2023-04-10 10:48:54,App to have very accurate as well,5,False,Meow1940,Great,"{'id': 35961574, 'body': ""Hi, thank you for your feedback! We're glad to hear that our app has been accurate for you. Our team is dedicated to providing the best possible experience to our users, and we are constantly working on improving the app. If you have any questions or suggestions, please don't hesitate to reach out to us. \nBest Wishes, Stress Monitor Team"", 'modified': '2023-04-14T16:15:31Z'}",US
2022-01-02 02:25:58,"Why does this happen so often, it’s in the free app section you download it then, they ask for annual fees. 
Let me try it and then I’ll see if I use it and see if it’s easy to use. 
Not cool.",2,False,un happy purchase,This is Not Free,"{'id': 27213490, 'body': 'Hi! Our App calculates a personal algorithm for monitoring stress. After this, you can use Stress Monitor App on your Apple Watch for free and see how it works for you. In the free Apple Watch app, you can see your last stress zone, hrv, and stress insights. In the premium app version, there is more deep-dive analytics on stress. If you have any questions about the app - please, always feel free to contact us at dev@activeace.app. Best Wishes, Elena from Stress Monitor Team', 'modified': '2022-01-03T21:31:10Z'}",US
2023-05-17 21:12:43,"If you do the latest update, it forces you to pay for the app. You can’t even get past the first screen without paying.",1,False,Terry83746,Do not do the latest update,,US
2022-11-17 17:02:21,It makes me cognizant of stressors so I can work to mitigate the impact.,5,False,Ridiculous57,Very Helpful!,,US
2022-12-13 17:01:12,I have gone through continuous stress … it doesn’t even record I am stressed when I am crying or melting down !!! The analytics are cool but there is no correlation between how stressed I am feeling and what the reading indicates….,1,False,HanaArjan,This doesn’t really work,,US
2022-11-08 15:09:32,Prefer this to other stress monitors. Simple to understand.,5,False,Fluffmeister ,Great!,,US
2022-11-11 21:34:00,I care for a cerebral palsy grandson and I’m keeping a eye on my stress level. And trying to learn more about the app..,4,False,sherrysmit,Stress,,US
2021-04-15 15:48:47,It’s way too expensive for something that u can literally use one time then it wants u to pay like 15-30$ for an app?,2,False,Cece.loves1,Wish it was free,"{'id': 22291064, 'body': 'Hello, let me explain to you this moment. The app calculates your personal algorithm for monitoring stress and shows your personal stress highlights. If you are not sure at that moment about the premium app version, you can use Stress Monitor Watch App to see how it works for you.\n\nFeel free to contact us at dev@activeace.app if you have any questions about the app - we’ll be glad to answer. \n\nBest Wishes, Stress Monitor App.', 'modified': '2021-04-16T21:23:24Z'}",US
2021-03-11 19:11:11,They act like it is free and you are like yes I finally found something that is free. But then as you click start it try’s to charge you 30 dollars a year. Why not say that you have to pay yearly before they download it. Disappointed,1,False,bubbleface960,Not free..,"{'id': 21771291, 'body': 'Hello, let me clarify this. \n\nIn the introduction the app calculates your personal model. Here you can do your first stress measurement, evaluate the results and even get your personal stress highlights for the last 30 days. \n\nLater you can decide about the subscription with premium features.\n\nWarm wishes, Stress Monitor Team', 'modified': '2021-03-20T13:13:05Z'}",US
2022-11-13 05:16:04,"The iPhone app does not update often or real time from iwatch ? 
It could take an entire day or not all? 
Not a great app",2,False,Chefbarbc,App upload from watch,,US
2023-02-24 23:10:08,Apparently no free trial. Enter all your info in and it brings you straight to the screen to pay. I’m certainly not paying as much as they want even if it is a good app.  That’s ridiculous,1,False,Nolacrazygrl,No free anything,,US
2022-10-19 13:54:55,"For some reason, I’m now always get the message, “this HRV  data is excluded for stress analytics purposes due to high value” (but it’s only in the 100’s - 200’s” 

Love the app before. Please help.",1,False,WooglinTL,Not working right since the update,,US
2023-02-15 18:53:58,I tried many times to get my data recorded to start using the app. Both EKG and breathe app just scrolled saying it was waiting on data. Never happened.,1,False,Rinchak,Didn’t work.,,US
2022-06-11 17:47:21,Wish it would update faster. I don’t need to know what my stress level was 16 hours ago.,3,False,meh2587543567,Meh,"{'id': 30357622, 'body': 'Hi! We are sorry, you are disappointed with the app. \n\nOur app processes the data that your Apple Watch records to Apple Health App during the day. The number of measurements depends on how active you are because some measurements happen when you are at rest for some time. \n\nWe also recommend you restart your Apple Watch to fix any cynс issues. \n\nPlease, feel free to contact us if you have any other questions.\n\nBest Wishes,\nElena Strok\nFounder of Stress Monitor App', 'modified': '2022-06-14T16:51:00Z'}",US
2022-01-06 02:56:22,I have been trying to cancel this subscription but there seems to be no way to do so. I haven’t written for help and have received zero response.,1,False,Gdadandgigi,No response for support,"{'id': 27430317, 'body': 'Hello, we are sorry that our reply to your message was delayed. We have answered your question in DM or e-mail. Please, let me know if you have any other questions. I’ll be happy to help.\nBest Wishes, Elena.', 'modified': '2022-01-13T21:10:28Z'}",US
2023-03-19 02:30:38,I opened the app and followed the instructions but I can’t get it to connect with the watch to be able to track my breathing,1,False,Pumaken,Can’t get the app to work,,US
2022-10-29 11:10:44,This app doesn’t seem accurate and didn’t allow me the trial option so I’m stuck paying for something that I cannot use.,1,False,loulou8878,Do not like.,"{'id': 32865871, 'body': 'Hi! We are sorry you are disappointed with the app. You can use Stress Monitor App on the Apple Watch for free and see if it works for you. It also includes free Stress Monitor Watch Face and notifications on your stress level. Please, feel free to contact us if you have any other questions and I’ll be happy to help. Best Wishes, Elena Strok, Founder of Stress Monitor App', 'modified': '2022-10-30T18:02:54Z'}",US
2022-11-14 00:01:26,Let’s me see the things in life that cause me stress!,5,False,cdns1000,Love it!,,US
2022-10-27 04:53:35,Tracking and reporting is pretty basic. Frustrating that you have to pay before you see what you get.,1,False,C.J.Bow,Not what I was looking for,"{'id': 32865956, 'body': 'Hi! We are sorry you are disappointed with the app. We continuously work on the app to make it better and to bring even more value to our users. If you have any questions or need assistance in canceling your subscription, please, feel free to contact us at dev@activeace.app. Best Wishes, Elena Strok', 'modified': '2022-10-30T18:13:24Z'}",US
