date,review,rating,isEdited,userName,title,developerResponse,Country
2022-10-31 14:54:14,"I bought the yearly subscription for this app, and it worked great. But recently it somehow glitches and defaulted to the free version of the app. my subscription is still in apple settings, but when I hit restore purchases it doesn’t load my subscription.",1,False,Ziru44,App won’t restore premium subscription,"{'id': 32962068, 'body': 'Hi! We are sorry you’ve faced that problem. Please, check that you are using the latest app version. I also recommend unloading the app from memory and then opening your premium app version. If it wouldn’t work, we recommend restarting your iPhone. I hope this help to fix the issue. If you have any other questions or difficulties, please, feel free to contact us at dev@activeace.app, and I’ll do my best to help. \n\nBest Wishes,\nElena Strok\nFounder of Stress Monitor App', 'modified': '2022-11-03T22:34:25Z'}",US
2023-01-04 17:15:41,It has provided a lot of information that has really helped me great app,5,False,The Mantu,Lots of help,"{'id': 34180700, 'body': 'Hi! Thank you for your review! We are happy to know you enjoy the app! \nWe’ll continue to work hard to improve the app and provide a great experience for all of our users. \n\nBest Wishes,\nElena Strok\nFounder of Stress Monitor App', 'modified': '2023-01-09T15:35:51Z'}",US
2022-10-03 17:27:09,"The highest stress levels I’ve had have been while relaxing and reading a book or watching TV.  The lowest stress levels have been when I’ve been on a walk or working.  I truly doubt the accuracy of this app, and hence it’s usefulness.  It’s like it has everything backwards.",1,False,Gnome58,I doubt everything about this app.,,US
2022-08-21 15:29:26,"I would really like to use Chinese language, I am a Chinese, if you can put Chinese language update on the agenda, thanks.",4,False,Chero Geroge,Please update Chinese as soon as possible,"{'id': 32020223, 'body': 'Hi! Thank you for your feedback! I have great news. We’ve recently added the Chinese (Simplified) language. I hope you’ll enjoy using the app and get even more value from it. \n\nBest Wishes,\nElena Strok\nFounder of Stress Monitor App', 'modified': '2022-09-14T15:57:59Z'}",US
2023-04-11 17:41:12,This stressed me out more than the actual stress I’ve been experiencing. In the middle of a medical emergency with my mom and the watch kept going off. I finally just deleted it.,3,False,leola65,Not for everyone,"{'id': 35961402, 'body': ""Hi! We're sorry to hear that our app didn't meet your expectations. We will take your feedback into consideration as we work to improve our app. Thank you for sharing your thoughts with us.\n\nBest Wishes, \nStress Monitor Team"", 'modified': '2023-04-14T16:05:23Z'}",US
2021-06-23 04:13:38,"Honestly, I received one small piece of data from the app and it without warning sends me into a dialog box where I’m forced to either subscribe or restore my subscriptions.  I don’t mind paying for good software. But I don’t like being strong armed without seeing any value.  Feels like a scam app.",1,False,MonkeyCall,Forceful subscription message,"{'id': 23558483, 'body': 'Hi! Our App calculates personal algorithm for monitoring stress and your stress highlights. In the iPhone app you’ll find deep dive analytics and premium features. If you are not sure about the subscription, you can continue to use our Stress Monitor App on your Apple Watch for free and see how it works for you. If you have any questions about the app - feel free to contact us at dev@activeace.app. \nBest Wishes, \nElena', 'modified': '2021-06-24T06:54:25Z'}",US
2023-03-14 21:32:59,I love this app. It keeps track of my sleep and monitors my coping with stress.  Amazing detail of my different body and heart functions.,5,False,RTAbeisbol,Amazing app,,US
2023-04-18 16:03:28,This would be a great app if it didn’t take several hours for data to be collected and shared.  The delay between the reading and the time it posts on the app makes the data irrelevant by the time you get it,2,False,Mwheel3,Significant delay,,US
2021-01-12 21:13:30,It is interesting to figure out when you are stressed and what helps you to be happy and productive. Good app for people who monitor their health,5,False,ola69la,Useful in times of stress,"{'id': 20666221, 'body': ""Thank you for your feedback! We're happy to hear that our app helps you to achieve your goals and be happy and productive! Our team continues to work and new exciting features become available with every new release. Thank you for staying with us and feel free to contact us with any questions at dev@activeace.app Warm wishes, Stress Monitor team"", 'modified': '2021-01-26T19:20:29Z'}",US
2022-10-18 23:26:26,"Been using it for just a few days. It consistently saying that I am in a high stress area when I am in a state that won't allow a person to be stressed.

Update.  Battery life got worse and still says I'm highly stressed when I am completely relaxed.  Upset that I paid for the year",1,False,saa1971,I dont know yet,"{'id': 32690567, 'body': ""Hi! Thank you for your feedback. The stress in the app is not only emotional or psychological but physical as well. Bad sleep last night, alcohol, heat, exhausting workout - all these can lower your body's resistance to stress. Follow your personal recommendations in the app to increase your body’s resistance to it. If you have any questions, please, feel free to contact us at dev@activeace.app, and I’ll be happy to help. Best Wishes, Elena Strok Founder of Stress Monitor App\n\nUpdate: Hi! We’re sorry you’re disappointed with the app. If you have any questions or need assistance in canceling your subscription or getting a refund, please, feel free to contact us at dev@activeace.app. Best Wishes, Elena Strok"", 'modified': '2022-10-20T12:54:35Z'}",US
2021-02-02 20:52:14,I’ve been enjoying seeing about my stress response through my Apple data. Very helpful for my health obsessed self.,5,False,nc102948475,Great app,"{'id': 21015931, 'body': 'Hello, thank you a lot for your feedback!\nWe’re happy that you’ve found our app helpful for monitoring your stress!\n\nWe strive to reveal the full potential of your Apple Watch in terms of stress & health monitoring.\n\nThank you a lot for being with us.\nWarm Wishes, Stress Monitor team', 'modified': '2021-02-12T10:06:14Z'}",US
2023-01-13 01:09:32,"Having to pay for features stressed me out, the app doesn’t provide much insight for free. It is pretty expensive for the service and that is stressful.",4,False,xomgtix,The app stresses me.,"{'id': 34318924, 'body': 'Hi! We are sorry you are disappointed with the app. You can use Stress Monitor App on the Apple Watch for free and see if it works for you. It also includes free Stress Monitor Watch Face and notifications on your stress level. Please, feel free to contact us if you have any other questions and I’ll be happy to help. Best Wishes, Stress Monitor Team', 'modified': '2023-01-16T19:37:16Z'}",US
2022-12-19 02:28:09,This looked like something that could be useful however it doesn’t let you “continue “ for free. You are forced to a subscription to continue to use the app. Unfortunately very expensive and will be deleting.,1,False,Stacyisme,Another app only useful with subscription,"{'id': 34046360, 'body': 'Hi! We are sorry you are disappointed with the app. You can use Stress Monitor App on the Apple Watch for free and see if it works for you. It also includes free Stress Monitor Watch Face and notifications on your stress level. Please, feel free to contact us if you have any other questions and I’ll be happy to help. Best Wishes, Stress Monitor Team', 'modified': '2023-01-02T14:27:02Z'}",US
2022-11-19 07:57:34,"I would like a 10 day free trial. I installed the app, went through 4 screens and bam! They want money. I can’t even tell what the app will show me or if I will find it helpful and I can’t go back and look at the previous screens. Just a short trial period please so I can see what the app is and what it will tell me.",1,False,Thorfiness,Free trial,,US
2022-07-27 21:50:06,"I was psyched when I saw this App. But it doesn’t work at all. It doesn’t deliver what it says it does and what it does deliver is not accurate. If you consciously contact support to report a problem, they basically tell you to go kick rocks. Even they know their app is worthless. The rudeness is just a slap in the face. Bu-bye now.",1,False,katpop711,Worthless-DONT WASTE YOUR TIME,,US
2022-11-25 01:32:57,"I enjoying really but can you explain a little detail.
Thank you",5,False,leonauwe,Review,"{'id': 33477263, 'body': 'Hi! Thank you for you feedback! We are happy to know you enjoy the app! Please, contact us at dev@activeace.app and I’ll be happy to help with any question about the app.\n\nBest Wishes,\nElena Strok\nFounder of Stress Monitor App', 'modified': '2022-12-01T14:35:40Z'}",US
2023-01-28 17:04:14,I do not pay yet. One reason I am not paying is the feedback is not adhesives for people with interrupted sleep such as on call or nightshift or just people who regularly nap.,3,False,Amhsturn,On call hours…,,US
2022-11-10 03:44:39,I got this app to track my stress levels for my Epilepsy.  It is pretty good except that it doesn’t work well for sleep.  A static must get 7-9 hours of sleep does not speak to everyone.  6 hours is great for me.,3,False,laj322,Stress down,,US
2022-09-05 19:03:32,Wasn’t sure if I really had all those keep an eye on it beeps or what? I decided to break from the app for a bit and will return,4,False,caseykir,Lots of stress,,US
2023-03-07 23:25:34,"Doesn't seem to update properly.

Not sure how it really works.

Will get a notification that I am experiencing stress and when I go to App nothing has been updated.",3,False,Stressed out Sarah,Stress App,,US
2022-12-07 12:02:10,"I’ve been using this app for a couple of weeks.  From what I’ve seen, if you are not using apple health and fully integrating all portions of health, the stress monitor is not accurate.  The app uses the health section of the phone to accumulate the stress level.",2,False,45632,App review,"{'id': 33633634, 'body': 'Hi! We’re sorry our app didn’t meet your expectations. The app requests access to read your health data to provide you with deep insights into your stress and the general state of your body. Please, contact us at dev@activeace.app if you need assistance in canceling your subscription or requesting a refund.\n\nBest Wishes,\nStress Monitor Team', 'modified': '2022-12-09T13:52:48Z'}",US
2020-07-19 16:34:25,App made me aware about my well being and now I can manage my stress and happiness with personalized data. Recommend!,5,False,mihael_utah,Amazing insights,"{'id': 16838236, 'body': 'Hi mihael_utah!\n\nThank you a lot for your feedback! We are happy to hear that stress radar provided useful findings for you!\n\nAs we are continuously working on the new features, we kindly ask you to join our incredible community and help us understand your needs for an even better experience with Stress Radar App!\n\nhttps://www.facebook.com/stressradar/', 'modified': '2020-07-23T20:28:24Z'}",US
2022-11-19 13:41:39,This app doesn’t work for me. It tells me to pay attention when I’m asleep and gives me an overload reading when I watch TV. When I’m physical active it tells me I’m great and when I overdo something it tells me normal. I don’t trust the readings or the app. I’ll just use my Apple Watch as before.,1,False,johnmikol,Wrong Readings,,US
2021-11-20 23:13:16,You have to pay for it in order to have full service and that is bull and stupid.,4,False,Fischer Justin,Stupid,"{'id': 26799914, 'body': 'Hi! Our App calculates personal algorithm for monitoring stress and your stress highlights. In the iPhone app you’ll find deep dive analytics and premium features. If you are not sure about the subscription, you can continue to use our Stress Monitor App on your Apple Watch for free and see how it works for you. If you have any questions about the app - feel free to contact us at dev@activeace.app. Best Wishes, Elena', 'modified': '2021-12-13T11:00:15Z'}",US
2023-01-27 21:15:34,"There should be numbers on the body feedback score. Dragging finger over the graph only to discover that the result is too high on the screen and therefore invisible, is super uncomfortable, slow and annoying method. Reveal the numbers already on the line.",2,False,Return to start after done,Stress graph,,US
2023-01-24 17:45:26,"Before committing to the monthly or yearly subscription, app does not even let you roam around and see the features.  I’m not spending money on something that I cannot try or even see all it’s features. No thanks!",1,False,Rechelle,Cannot even try without purchase,"{'id': 34504932, 'body': ""Hi! We are sorry our app doesn't meet your expectations. You can use Stress Monitor App on the Apple Watch for free and see if it works for you. It also includes free Stress Monitor Watch Face and notifications on your stress level. Please, feel free to contact us if you have any other questions and I’ll be happy to help.\xa0\n\nBest Wishes,\nStress Monitor Team"", 'modified': '2023-01-26T21:03:15Z'}",US
2022-11-05 11:51:01,It’s really helpful to know when & where I’m feeling stressed & when I’m at my best & most relaxed !,5,False,Jennie Baldwin,Love this app!,,US
2022-12-17 01:51:41,I cannot figure out the relationship between the score and the description   I would really like an answer.,3,False,Vet15010,Makes no sense,"{'id': 34070039, 'body': 'Hi! We’re sorry our app didn’t meet your expectations. We will take your feedback into consideration as we continue to work on improving the app. If you have any other questions, please, feel free to contact us at dev@activeace.app and we’ll do our best to help.\n\nBest Wishes,\nStress Monitor Team', 'modified': '2023-01-03T16:39:04Z'}",US
2022-08-04 23:56:25,"I love the premise, but it doesn’t work. The app tells me I’m “overloading” when I’m perfectly fine. Then, when I’m so stressed out I can’t breathe, it doesn’t say anything. I’m really disappointed, and wish I knew why it was so buggy.",2,False,Ajenks96,Doesn’t work,"{'id': 31469143, 'body': ""Hi! We are sorry you are disappointed with the app. The stress in the app is not only emotional or psychological but physical as well. Bad sleep last night, alcohol, exhausting workout - all these can lower your body's resistance to stress the next day or longer. We recommend considering your stress trends to better understand how your body copes with stress over time and to identify dependencies, that can lead to lower or higher results. If you have any other questions, feel free to contact us at dev@aciveace.app I’ll be happy to help.\n\nBest Wishes,\nElena Strok\nFounder of Stress Monitor App"", 'modified': '2022-08-15T15:21:47Z'}",US
2022-05-17 15:39:33,So far the monitor is helping me to realize I’m under more stress than I realized maybe I internalize too much. Now that I have the information I have to figure out how to affect it but the positive.,3,False,Destarte2,New to the monitor,"{'id': 29910182, 'body': 'Hello, thank you for your feedback. We are glad to know that our app helps you to better understand your stress and body signals. \nWe continuously work on the app and extend its functionality. We’ll take your feedback into account to make the app better and bring even more value.\n\nPlease, always feel free to contact us if you have any questions or suggestions about the app. \n\nBest Wishes,\nElena Strok\nFounder of Stress Monitor App', 'modified': '2022-05-23T11:49:17Z'}",US
2022-04-14 04:37:19,Today I was notified of an unusual reading number of 666 on my iWatch.  What’s up with this freaky reading?,5,False,Cam and Tom,Alarming stress number,,US
2023-06-06 14:20:24,App was ok until most recent update. The premium subscription cost is unjustified. I enjoy the interface but there are plenty of other apps that provide the same info for free.,2,False,imoutnextweek,Shop around,,US
2022-12-03 14:47:01,"I’ve had times when I’m stressed and it returns a “Great” rating and literally while completely relaxed on a quiet beach have it interrupt saying I’m overloaded with stress.

Seems like a lot of bells, whistles and fancy interface to interpret sketchy or inaccurate  data.",2,False,Mtmurat,Skeptical,"{'id': 33634338, 'body': ""Hi! We are sorry our app didn’t meet your expectations. The stress in the app is not only emotional or psychological but physical as well. Insufficient sleep last night, alcohol, heat, and an exhausting workout can lower your body's resistance to stress. We recommend considering your daily and weekly stress trends to understand how your body copes with stress over time and to identify dependencies, that can lead to lower or higher results.\n\nBest Wishes,\nStress Monitor Team"", 'modified': '2022-12-09T14:32:10Z'}",US
2022-11-14 19:11:57,"I think the app seems to work well.  I can usually tell when I’m more stressed, both physically and emotionally.  The app is a bit of a warning signal for me.  I like it!!

I’d benefit from a bit more info on the number ranges for each category of how I’m feeling.  Is this different for everyone, or does it vary based on our past readings?

Thanks, 
Deb",4,False,capndeb62,Great App,,US
2022-11-09 18:36:08,Unable to use heat map as it stopped working only indicates overload never normal or pay attention,4,False,Knapproad,Heat map stopped indicating daily values,,US
2021-02-06 23:36:11,The recent update added useful nuances.,5,False,Ashlarah,Interesting insights from using app,"{'id': 21015427, 'body': 'Hello, \nThank you a lot for your feedback!\nWe are happy that you like your last update!\nOur team continues to work hard to bring even more value to our users with every new release. \n\nThank you a lot for being with us.\nWarm Wishes, Stress Monitor team.', 'modified': '2021-02-12T09:41:37Z'}",US
2022-12-19 00:15:51,Love having the numbers to verify my stress/ back up my feelings.  Numbers seem to be right on par.,5,False,navynursesea,Nice app! Loving it,"{'id': 34069820, 'body': 'Thank you so much for your positive feedback! We really appreciate it and are glad to hear that you are enjoying the app. We will continue to work hard to improve the app and provide the best experience possible. Thank you again for your support!\n\nBest Wishes,\nStress Monitor Team', 'modified': '2023-01-03T16:25:12Z'}",US
2022-12-31 13:20:48,The free version is basically useless and the premium version (which the app pushes hard almost immediately after getting access to your health data) is very expensive.  Extremely disappointed.,1,False,Jrl1234,don’t bother,"{'id': 34047299, 'body': 'Hi! We are sorry you are disappointed with the app. You can use Stress Monitor App on the Apple Watch for free and see if it works for you. It also includes free Stress Monitor Watch Face and notifications on your stress level. Please, feel free to contact us if you have any other questions and I’ll be happy to help. Best Wishes, Stress Monitor Team', 'modified': '2023-01-02T15:27:23Z'}",US
2022-11-08 15:45:46,"I am TIRED of apps that have you go through an entire log in/create a password step BEFORE it tells you there’s a monthly fee to use it. If I knew that, I’d never have downloaded it in the first place. Talk about adding to someone’s stress! Yeesh…",1,False,zsherman,"Subscription model, but not told—",,US
2023-05-19 02:13:29,"I use to love to see my body reaction to life , but now , since last update ,no more free options , only premium subscription. Too bad, Will  delete it",3,False,Zambezi.,No more free cheese.,"{'id': 36758300, 'body': ""Hi! We understand that our current pricing model may not be suitable for everyone, and we apologize for any inconvenience this may cause. You can always use our app on your Apple Watch. It's free and includes Watch face and complications, stress notifications, and the recent stress result. Thank you for your understanding and have a great day! \n\nBest Wishes,\nElena Strok\nFounder of Stress Monitor App"", 'modified': '2023-05-26T17:39:48Z'}",US
2023-04-21 20:24:33,It needs to update more. I don’t stay at one level for hours. It should register changes.,3,False,Bosm**|••£,Updates,,US
2023-04-16 17:06:43,I nervous and tense a lot and I believe that flight or fight instinct keeps me worn out,5,False,tny54,Explains why I’m always exhausted!!,,US
2022-12-04 23:01:22,"The readouts from this program bear no resemblance whatsoever to the stressful periods during my week. They’re showing up on weekends and it odd times in the middle of the night comparing notes with others that are using it. I think that it’s flawed, considering discontinuing.",1,False,puh-leez,Not so much,"{'id': 33610798, 'body': ""Hi! We’re sorry our app doesn't work for you. If you have any questions or need assistance in canceling your subscription, please, feel free to contact us at dev@activeace.app and we’ll be happy to help. Best Wishes, Stress Monitor Team"", 'modified': '2022-12-08T13:07:27Z'}",US
2022-12-16 17:10:00,Unable to tell if this app is worth cost or not.  There is NO trial period.  It connects and gives you a week review the same time you open.  That is not a good measure when you have not used over the last week.  No thanks!,1,False,BeckyDYN,Expensive,"{'id': 33813107, 'body': 'Hi! We are sorry you are disappointed with the app. You can use Stress Monitor App on the Apple Watch for free and see if it works for you. It also includes free Stress Monitor Watch Face and notifications on your stress level. Please, feel free to contact us if you have any other questions and I’ll be happy to help. \n\nBest Wishes,\nElena Strok,\nFounder of Stress Monitor App', 'modified': '2022-12-19T17:52:27Z'}",US
2023-03-21 02:16:11,"This does not seem accurate at all in monitoring stress levels. When I’m stressed, it says normal and when I’m at rest it says I’m overloaded. Not really doing what I was hoping. ☹️",3,False,qarjeat,Not what I’d hoped…,,US
2023-02-07 18:16:20,"After a yearly payment was taken out, this app no longer works prior to this it was recording everything once it was paid for now I can’t access it.",1,False,Pag@1965,Haven’t been able to use.,,US
2021-11-30 01:34:09,"I have Very bad anxiety & depression, & feel like this app gives me a little piece of mind…",5,False,HahaNeat,Love it!,"{'id': 26832830, 'body': 'Hi, Thank you for the feedback! We are happy to know that our app helps you take better care of ourself. Our team is continuously working on the app to make it better and bring even more value. Please, always feel free to contact us if you have any other questions or suggestions about the app. Warm Wishes, Elena from Stress Monitor Team.', 'modified': '2021-12-14T17:50:49Z'}",US
2023-01-24 18:46:39,I wish there was a one time fee instead of an expensive subscription. The developers need to make sure to communicate that the app won’t work unless you have a subscription.,1,False,Famphoto,Expensive Subscription,"{'id': 34504885, 'body': ""Hi! We are sorry our app doesn't meet your expectations. You can use Stress Monitor App on the Apple Watch for free and see if it works for you. It also includes free Stress Monitor Watch Face and notifications on your stress level. Please, feel free to contact us if you have any other questions and I’ll be happy to help.\n\nBest Wishes,\nStress Monitor Team"", 'modified': '2023-01-26T20:59:24Z'}",US
2022-12-23 16:54:14,"Avoid this scam app. I’ve asked Apple to investigate the developer, I’ll report back with the resolution. 

Lost my “lifetime” subscription after switching to new phone. $20/month or $50/year. That subscription price is disgusting for the very basic app functions.",1,False,theglassguy,Scam - must avoid,,US
2022-11-08 06:21:41,"I don’t mind paying to support a helpful and/or interesting app, but this doesn’t let me see any of what the app does or how without paying. I’m not going to buy a month just to figure out if I like it enough to pay. 🙄",1,False,ben3141,Can’t tell what the app does,,US
2021-12-29 17:03:23,This app has only been right about times I am stressed once in three weeks. The other times have been a lag of a full day or more.,2,False,thatrockgurl,Not accurate,"{'id': 27152014, 'body': 'Hi, Thank you for your feedback. We’re sorry, that our app didn’t meet your expectations.\xa0\nWe are continuously working on the app to make it better and to bring even more value to all our users.\n\nIf you need a refund, please, contact us at dev@activeace.app and we’ll share instructions how to do it.\n\nBest Wishes, \nElena from Stress Monitor Team', 'modified': '2021-12-30T21:24:52Z'}",US
2021-11-15 18:17:57,I love the app and the simplicity of it if only I could get it to track consistently I’d be happy,3,False,dozerman21,If it would track consistently would be 5 stars,"{'id': 26324117, 'body': 'Hi! Thank you for your feedback. \nWe are happy to hear that you like Stress Monitor.\nRight now there are technical limitations for consistent tracking.\n\nBut our team is continuously working on the app, we take into account every feedback to make the app better and to bring maximum value to all our users with every new release. If you have any questions - please, always feel free to contact us at dev@activeace.app\n\nBest Wishes, Elena from Stress Monitor Team', 'modified': '2021-11-17T14:40:04Z'}",US
2023-03-12 16:04:03,"I don’t wear my watch everyday, yet I still get notifications about how much I’m stressed and I need recovery. I therefore question its accuracy in general.",2,False,Ori2184,Takes measures when my watch is off,,US
